title,description,source,published_date,url,category,relevance_weight,sentiment_score,sentiment_magnitude,sentiment_confidence,risk_signal,weighted_risk_signal,text_length
TSMC Reports Strong Q4 Earnings Despite Supply Chain Challenges,Taiwan Semiconductor Manufacturing Company reports robust quarterly results while navigating ongoing supply chain complexities and geopolitical tensions.,Reuters,2025-08-24 22:41:59.495495,https://example.com/tsmc-earnings,company_specific,1.2,0.43333333333333335,0.43333333333333335,0.2666666666666666,0.2833333333333333,0.33999999999999997,218
US Expands Semiconductor Export Controls to China,The Biden administration announces new restrictions on semiconductor equipment exports to Chinese companies.,Financial Times,2025-08-23 22:41:59.495495,https://example.com/us-china-semiconductors,general_market,1.0,0.06818181818181818,0.06818181818181818,0.7727272727272727,0.46590909090909094,0.46590909090909094,159
Intel Announces $20B Arizona Fab Expansion,Intel reveals plans to expand its Arizona semiconductor manufacturing facilities.,TechCrunch,2025-08-22 22:41:59.495495,https://example.com/intel-arizona-expansion,company_specific,1.2,0.375,0.375,0.125,0.3125,0.375,134
Global Chip Shortage Continues to Impact Auto Industry,Automotive manufacturers report ongoing production delays due to persistent semiconductor shortages.,Automotive News,2025-08-21 22:41:59.495495,https://example.com/auto-chip-shortage,company_specific,1.2,-0.0625,0.0625,0.8125,0.5843750000000001,0.70125,156
Taiwan Strengthens Semiconductor Security Measures,Taiwan implements new security protocols for its critical semiconductor infrastructure.,Bloomberg,2025-08-20 22:41:59.495495,https://example.com/taiwan-semiconductor-security,company_specific,1.2,0.1,0.1,0.6,0.45,0.54,165
